Entrada,Departamento,Prioridad
"Revisar y aprobar el presupuesto trimestral para el proximo ano.",Finanzas y Contabilidad,0.90
"Contratar a un nuevo representante de ventas para la region norte.",Recursos Humanos,0.80
"Lanzar una campana de marketing en redes sociales para el nuevo producto.",Ventas y Marketing,0.85
"Optimizar el proceso de produccion para reducir costos.",Operaciones o Produccion,0.75
"Resolver el problema de caida del servidor en la plataforma de clientes.",Tecnologia de la Informacion,0.95
"Atender las quejas de los clientes sobre el retraso en los envios.",Atencion al Cliente,0.88
"Comprar materiales de oficina para el proximo trimestre.",Compras y Abastecimiento,0.60
"Desarrollar un nuevo prototipo para la linea de productos sostenibles.",Investigacion y Desarrollo,0.82
"Revisar los contratos con los proveedores para asegurar el cumplimiento legal.",Legal y Cumplimiento,0.78
"Organizar la reunion mensual de la junta directiva.",Administracion y Gestion General,0.70
"Capacitar al personal en el nuevo software de gestion de proyectos.",Recursos Humanos,0.75
"Auditar los estados financieros del ultimo trimestre.",Finanzas y Contabilidad,0.88
"Disenar una estrategia de ventas para el mercado internacional.",Ventas y Marketing,0.83
"Reparar la maquinaria defectuosa en la linea de produccion.",Operaciones o Produccion,0.92
"Actualizar el sistema de seguridad de la red corporativa.",Tecnologia de la Informacion,0.89
"Responder a las consultas de los clientes sobre la garantia del producto.",Atencion al Cliente,0.77
"Negociar con proveedores para obtener mejores precios en materias primas.",Compras y Abastecimiento,0.81
"Investigar nuevas tecnologias para mejorar la eficiencia energetica.",Investigacion y Desarrollo,0.79
"Revisar las politicas de privacidad para cumplir con las nuevas regulaciones.",Legal y Cumplimiento,0.86
"Preparar el informe anual de desempeno de la empresa.",Administracion y Gestion General,0.84
"Realizar entrevistas para el puesto de gerente de ventas.",Recursos Humanos,0.82
"Analizar los flujos de caja para identificar posibles problemas de liquidez.",Finanzas y Contabilidad,0.87
"Crear contenido para la campana de lanzamiento del nuevo producto.",Ventas y Marketing,0.80
"Implementar un sistema de control de calidad en la linea de produccion.",Operaciones o Produccion,0.83
"Migrar los datos de la empresa a la nube.",Tecnologia de la Informacion,0.90
"Resolver las quejas sobre el mal servicio al cliente en la tienda en linea.",Atencion al Cliente,0.91
"Comprar equipos nuevos para el departamento de IT.",Compras y Abastecimiento,0.72
"Desarrollar una nueva formula para un producto cosmetico.",Investigacion y Desarrollo,0.85
"Revisar los terminos y condiciones del contrato con un nuevo cliente.",Legal y Cumplimiento,0.79
"Coordinar la logistica para el evento anual de la empresa.",Administracion y Gestion General,0.76
"Evaluar el desempeno de los empleados para el ciclo de revisiones.",Recursos Humanos,0.78
"Preparar el informe de impuestos para el ano fiscal.",Finanzas y Contabilidad,0.93
"Disenar un plan de fidelizacion para clientes recurrentes.",Ventas y Marketing,0.81
"Reducir los tiempos de entrega en la cadena de suministro.",Operaciones o Produccion,0.84
"Implementar un nuevo software de gestion de inventarios.",Tecnologia de la Informacion,0.88
"Capacitar al equipo de soporte en tecnicas de resolucion de conflictos.",Atencion al Cliente,0.74
"Comprar material de empaque ecologico para los productos.",Compras y Abastecimiento,0.68
"Investigar tendencias de mercado para lanzar un nuevo servicio.",Investigacion y Desarrollo,0.80
"Revisar las clausulas de confidencialidad en los contratos laborales.",Legal y Cumplimiento,0.77
"Planificar la agenda del CEO para la proxima semana.",Administracion y Gestion General,0.73
"Organizar un taller de formacion sobre diversidad e inclusion.",Recursos Humanos,0.70
"Analizar los costos de produccion para identificar areas de ahorro.",Finanzas y Contabilidad,0.82
"Crear un plan de publicidad para la temporada navidena.",Ventas y Marketing,0.86
"Mejorar la eficiencia en la linea de ensamblaje.",Operaciones o Produccion,0.79
"Solucionar el problema de conectividad en la oficina central.",Tecnologia de la Informacion,0.94
"Responder a las preguntas de los clientes sobre el nuevo servicio.",Atencion al Cliente,0.76
"Comprar herramientas para el equipo de mantenimiento.",Compras y Abastecimiento,0.65
"Desarrollar una aplicacion movil para la gestion de pedidos.",Investigacion y Desarrollo,0.87
"Revisar los acuerdos de confidencialidad con los socios comerciales.",Legal y Cumplimiento,0.81
"Organizar la celebracion del aniversario de la empresa.",Administracion y Gestion General,0.69
"Realizar una auditoria interna de los procesos de nomina.",Finanzas y Contabilidad,0.87
"Contratar a un especialista en marketing digital para la campana de verano.",Recursos Humanos,0.83
"Crear un plan de incentivos para el equipo de ventas.",Ventas y Marketing,0.79
"Mejorar la logistica de distribucion para reducir tiempos de entrega.",Operaciones o Produccion,0.85
"Instalar un nuevo firewall para proteger la red corporativa.",Tecnologia de la Informacion,0.91
"Resolver las quejas de los clientes sobre facturas incorrectas.",Atencion al Cliente,0.88
"Comprar materias primas para la produccion del proximo mes.",Compras y Abastecimiento,0.75
"Desarrollar un nuevo algoritmo para optimizar el rendimiento del software.",Investigacion y Desarrollo,0.89
"Revisar los contratos de arrendamiento de las oficinas.",Legal y Cumplimiento,0.77
"Organizar la capacitacion anual sobre seguridad en el trabajo.",Administracion y Gestion General,0.72
"Evaluar el clima laboral mediante una encuesta de satisfaccion.",Recursos Humanos,0.80
"Preparar el informe de gastos operativos del ultimo trimestre.",Finanzas y Contabilidad,0.84
"Lanzar una promocion especial para clientes frecuentes.",Ventas y Marketing,0.82
"Implementar un sistema de mantenimiento preventivo para la maquinaria.",Operaciones o Produccion,0.86
"Migrar la base de datos a un servidor mas potente.",Tecnologia de la Informacion,0.92
"Atender las solicitudes de reembolso de los clientes.",Atencion al Cliente,0.78
"Comprar equipos de seguridad para el personal de produccion.",Compras y Abastecimiento,0.70
"Investigar nuevas fuentes de energia renovable para la empresa.",Investigacion y Desarrollo,0.83
"Revisar los acuerdos de confidencialidad con los empleados.",Legal y Cumplimiento,0.79
"Coordinar la renovacion de las licencias de software.",Administracion y Gestion General,0.74
"Contratar a un consultor externo para mejorar la estrategia de recursos humanos.",Recursos Humanos,0.81
"Analizar los margenes de ganancia de los ultimos seis meses.",Finanzas y Contabilidad,0.88
"Disenar una campana publicitaria para el lanzamiento de la nueva app.",Ventas y Marketing,0.85
"Optimizar el flujo de trabajo en la linea de produccion.",Operaciones o Produccion,0.84
"Implementar un sistema de respaldo automatico para los datos criticos.",Tecnologia de la Informacion,0.93
"Capacitar al equipo de atencion al cliente en resolucion de conflictos.",Atencion al Cliente,0.76
"Comprar material de oficina para el nuevo departamento.",Compras y Abastecimiento,0.65
"Desarrollar un nuevo producto basado en inteligencia artificial.",Investigacion y Desarrollo,0.90
"Revisar los terminos de los contratos con los clientes internacionales.",Legal y Cumplimiento,0.82
"Organizar el evento de fin de ano para los empleados.",Administracion y Gestion General,0.71
"Realizar una evaluacion de desempeno para el equipo de ventas.",Recursos Humanos,0.78
"Preparar el presupuesto para el proximo proyecto de expansion.",Finanzas y Contabilidad,0.89
"Crear una estrategia de contenido para redes sociales.",Ventas y Marketing,0.80
"Reducir los desperdicios en el proceso de fabricacion.",Operaciones o Produccion,0.83
"Actualizar los sistemas de videoconferencia para mejorar la comunicacion.",Tecnologia de la Informacion,0.87
"Resolver las quejas sobre el tiempo de espera en el soporte tecnico.",Atencion al Cliente,0.81
"Comprar equipos de laboratorio para el departamento de I+D.",Compras y Abastecimiento,0.73
"Investigar nuevas tecnicas de fabricacion para reducir costos.",Investigacion y Desarrollo,0.84
"Revisar las politicas de seguridad de la informacion.",Legal y Cumplimiento,0.85
"Coordinar la actualizacion de los manuales de procedimientos.",Administracion y Gestion General,0.75
"Contratar a un experto en cumplimiento normativo.",Recursos Humanos,0.82
"Analizar los costos de transporte para optimizar las rutas de entrega.",Finanzas y Contabilidad,0.86
"Lanzar una campana de email marketing para clientes existentes.",Ventas y Marketing,0.79
"Implementar un sistema de gestion de inventarios en tiempo real.",Operaciones o Produccion,0.88
"Solucionar problemas de conectividad en las sucursales remotas.",Tecnologia de la Informacion,0.94
"Atender las solicitudes de devolucion de productos defectuosos.",Atencion al Cliente,0.77
"Comprar herramientas para el equipo de mantenimiento de IT.",Compras y Abastecimiento,0.68
"Desarrollar un prototipo de vehiculo electrico para la empresa.",Investigacion y Desarrollo,0.91
"Revisar los acuerdos de confidencialidad con los proveedores.",Legal y Cumplimiento,0.80
"Organizar la capacitacion en liderazgo para los gerentes.",Administracion y Gestion General,0.76
"Realizar una encuesta de satisfaccion salarial entre los empleados.",Recursos Humanos,0.75
"Preparar el informe de flujo de caja para la junta directiva.",Finanzas y Contabilidad,0.90
"Disenar una campana de publicidad en Google Ads para aumentar las ventas.",Ventas y Marketing,0.85
"Reorganizar el layout de la fabrica para mejorar la eficiencia.",Operaciones o Produccion,0.82
"Implementar un sistema de autenticacion de dos factores para los empleados.",Tecnologia de la Informacion,0.92
"Resolver las quejas de los clientes sobre el servicio de postventa.",Atencion al Cliente,0.88
"Comprar insumos para la produccion del proximo trimestre.",Compras y Abastecimiento,0.78
"Desarrollar un nuevo software de gestion de proyectos.",Investigacion y Desarrollo,0.87
"Revisar los contratos de los proveedores para asegurar el cumplimiento de normas.",Legal y Cumplimiento,0.83
"Organizar la reunion anual de accionistas.",Administracion y Gestion General,0.80
"Capacitar al personal en el uso de nuevas herramientas de productividad.",Recursos Humanos,0.77
"Auditar los gastos de viaje de los ejecutivos.",Finanzas y Contabilidad,0.86
"Crear una estrategia de ventas cruzadas para aumentar los ingresos.",Ventas y Marketing,0.84
"Implementar un sistema de control de calidad en la linea de produccion.",Operaciones o Produccion,0.89
"Migrar las aplicaciones internas a la nube para mejorar la accesibilidad.",Tecnologia de la Informacion,0.93
"Atender las solicitudes de garantia de los productos vendidos.",Atencion al Cliente,0.81
"Comprar equipos de proteccion personal para los empleados de produccion.",Compras y Abastecimiento,0.74
"Investigar nuevas tecnologias para reducir el impacto ambiental.",Investigacion y Desarrollo,0.85
"Revisar las politicas de privacidad de datos de los clientes.",Legal y Cumplimiento,0.88
"Coordinar la logistica para la conferencia anual de la empresa.",Administracion y Gestion General,0.79
"Realizar entrevistas para cubrir el puesto de gerente de operaciones.",Recursos Humanos,0.82
"Analizar los costos de produccion para identificar areas de mejora.",Finanzas y Contabilidad,0.87
"Lanzar una campana de descuentos para clientes recurrentes.",Ventas y Marketing,0.83
"Optimizar el proceso de embalaje para reducir costos.",Operaciones o Produccion,0.84
"Implementar un sistema de monitoreo en tiempo real para los servidores.",Tecnologia de la Informacion,0.94
"Resolver las quejas sobre el tiempo de respuesta del soporte tecnico.",Atencion al Cliente,0.80
"Comprar material de oficina para el nuevo departamento de ventas.",Compras y Abastecimiento,0.70
"Desarrollar un nuevo producto basado en blockchain.",Investigacion y Desarrollo,0.89
"Revisar los acuerdos de confidencialidad con los socios estrategicos.",Legal y Cumplimiento,0.84
"Organizar el evento de lanzamiento del nuevo producto.",Administracion y Gestion General,0.78
"Evaluar el desempeno de los empleados para el ciclo de promociones.",Recursos Humanos,0.81
"Preparar el informe de impuestos corporativos para el ano fiscal.",Finanzas y Contabilidad,0.91
"Crear una estrategia de marketing viral para el nuevo servicio.",Ventas y Marketing,0.86
"Reducir los tiempos de inactividad en la linea de produccion.",Operaciones o Produccion,0.87
"Implementar un sistema de gestion de incidentes para el departamento de IT.",Tecnologia de la Informacion,0.92
"Capacitar al equipo de atencion al cliente en tecnicas de ventas.",Atencion al Cliente,0.76
"Comprar equipos de prueba para el laboratorio de I+D.",Compras y Abastecimiento,0.73
"Investigar nuevas tendencias de mercado para lanzar un producto innovador.",Investigacion y Desarrollo,0.88
"Revisar los contratos laborales para asegurar el cumplimiento de leyes locales.",Legal y Cumplimiento,0.85
"Coordinar la actualizacion de los manuales de procedimientos de la empresa.",Administracion y Gestion General,0.77
"Contratar a un especialista en diversidad e inclusion.",Recursos Humanos,0.79
"Analizar los costos de logistica para optimizar las rutas de distribucion.",Finanzas y Contabilidad,0.86
"Lanzar una campana de marketing en influencers para aumentar la visibilidad.",Ventas y Marketing,0.84
"Mejorar la eficiencia energetica en las instalaciones de produccion.",Operaciones o Produccion,0.83
"Implementar un sistema de backup en la nube para los datos criticos.",Tecnologia de la Informacion,0.93
"Resolver las quejas de los clientes sobre la calidad del producto.",Atencion al Cliente,0.82
"Comprar herramientas para el equipo de mantenimiento de las instalaciones.",Compras y Abastecimiento,0.72
"Desarrollar un prototipo de aplicacion movil para la gestion de inventarios.",Investigacion y Desarrollo,0.90
"Revisar los acuerdos de confidencialidad con los clientes corporativos.",Legal y Cumplimiento,0.87
"Organizar la capacitacion en habilidades blandas para los empleados.",Administracion y Gestion General,0.75
"Realizar una evaluacion de clima laboral para identificar areas de mejora.",Recursos Humanos,0.78
"Preparar el informe de ingresos y gastos para la junta directiva.",Finanzas y Contabilidad,0.89
"Disenar una campana de marketing en TikTok para llegar a un publico mas joven.",Ventas y Marketing,0.83
"Optimizar el proceso de almacenamiento para reducir costos logisticos.",Operaciones o Produccion,0.85
"Implementar un sistema de gestion de contrasenas para mejorar la seguridad.",Tecnologia de la Informacion,0.91
"Atender las quejas de los clientes sobre el tiempo de entrega de los productos.",Atencion al Cliente,0.87
"Comprar materias primas para la produccion del proximo mes.",Compras y Abastecimiento,0.76
"Desarrollar un nuevo algoritmo de recomendacion para la plataforma de ventas.",Investigacion y Desarrollo,0.88
"Revisar los contratos de los proveedores para asegurar terminos favorables.",Legal y Cumplimiento,0.82
"Organizar la reunion trimestral de revision de objetivos.",Administracion y Gestion General,0.79
"Capacitar al personal en el uso de herramientas de analisis de datos.",Recursos Humanos,0.80
"Auditar los gastos de marketing del ultimo trimestre.",Finanzas y Contabilidad,0.86
"Crear una estrategia de ventas para expandirse a nuevos mercados.",Ventas y Marketing,0.84
"Implementar un sistema de mantenimiento predictivo para la maquinaria.",Operaciones o Produccion,0.88
"Migrar las aplicaciones internas a un servidor mas seguro.",Tecnologia de la Informacion,0.92
"Resolver las solicitudes de reembolso de los clientes de manera agil.",Atencion al Cliente,0.81
"Comprar equipos de seguridad para el personal de almacen.",Compras y Abastecimiento,0.73
"Investigar nuevas tecnologias para mejorar la calidad del producto.",Investigacion y Desarrollo,0.87
"Revisar las politicas de privacidad de datos de los empleados.",Legal y Cumplimiento,0.85
"Coordinar la logistica para el evento de lanzamiento del nuevo producto.",Administracion y Gestion General,0.80
"Realizar entrevistas para cubrir el puesto de gerente de marketing.",Recursos Humanos,0.83
"Analizar los margenes de ganancia de los productos mas vendidos.",Finanzas y Contabilidad,0.88
"Lanzar una campana de email marketing para promocionar las ofertas de fin de ano.",Ventas y Marketing,0.82
"Optimizar el proceso de embalaje para reducir costos y desperdicios.",Operaciones o Produccion,0.84
"Implementar un sistema de monitoreo en tiempo real para la red corporativa.",Tecnologia de la Informacion,0.93
"Resolver las quejas de los clientes sobre la falta de stock en los productos.",Atencion al Cliente,0.79
"Comprar material de oficina para el nuevo equipo de ventas.",Compras y Abastecimiento,0.71
"Desarrollar un nuevo prototipo de producto basado en inteligencia artificial.",Investigacion y Desarrollo,0.90
"Revisar los acuerdos de confidencialidad con los socios comerciales.",Legal y Cumplimiento,0.86
"Organizar la capacitacion en habilidades de liderazgo para los gerentes.",Administracion y Gestion General,0.77
"Evaluar el desempeno de los empleados para el ciclo de bonificaciones.",Recursos Humanos,0.81
"Preparar el informe de impuestos corporativos para el proximo ano fiscal.",Finanzas y Contabilidad,0.92
"Crear una estrategia de marketing digital para aumentar la visibilidad de la marca.",Ventas y Marketing,0.85
"Reducir los tiempos de inactividad en la linea de produccion mediante mejoras tecnicas.",Operaciones o Produccion,0.89
"Implementar un sistema de respaldo automatico para los servidores criticos.",Tecnologia de la Informacion,0.94
"Capacitar al equipo de atencion al cliente en tecnicas de ventas cruzadas.",Atencion al Cliente,0.78
"Comprar equipos de prueba para el laboratorio de control de calidad.",Compras y Abastecimiento,0.74
"Investigar nuevas tendencias de mercado para lanzar un producto innovador.",Investigacion y Desarrollo,0.89
"Revisar los contratos laborales para asegurar el cumplimiento de las normativas locales.",Legal y Cumplimiento,0.84
"Coordinar la actualizacion de los manuales de procedimientos de la empresa.",Administracion y Gestion General,0.76
"Contratar a un especialista en diversidad e inclusion para mejorar el clima laboral.",Recursos Humanos,0.82
"Analizar los costos de transporte para optimizar las rutas de distribucion.",Finanzas y Contabilidad,0.87
"Lanzar una campana de marketing en influencers para aumentar la visibilidad de la marca.",Ventas y Marketing,0.86
"Mejorar la eficiencia energetica en las instalaciones de produccion.",Operaciones o Produccion,0.83
"Implementar un sistema de backup en la nube para los datos criticos de la empresa.",Tecnologia de la Informacion,0.95
"Resolver las quejas de los clientes sobre la calidad del servicio postventa.",Atencion al Cliente,0.80
"Comprar herramientas para el equipo de mantenimiento de las instalaciones.",Compras y Abastecimiento,0.72
"Desarrollar un prototipo de aplicacion movil para la gestion de inventarios.",Investigacion y Desarrollo,0.91
"Revisar los acuerdos de confidencialidad con los clientes corporativos.",Legal y Cumplimiento,0.88
"Organizar la capacitacion en habilidades blandas para los empleados.",Administracion y Gestion General,0.75
"Programar una reunion de equipo para discutir el proximo lanzamiento de producto.",Administracion y Gestion General,0.75
"Revisar el informe financiero del ultimo trimestre.",Finanzas y Contabilidad,0.9
"Responder a las consultas de los clientes sobre el estado de sus pedidos.",Atencion al Cliente,0.8
"Desarrollar una nueva campana de marketing para aumentar las ventas.",Ventas y Marketing,0.85
"Realizar el mantenimiento preventivo de la maquinaria de produccion.",Operaciones o Produccion,0.7
"Actualizar el software antivirus en todos los equipos de la empresa.",Tecnologia de la Informacion,0.95
"Negociar un nuevo contrato con un proveedor de materias primas.",Compras y Abastecimiento,0.8
"Investigar nuevas tecnologias para mejorar la eficiencia de la produccion.",Investigacion y Desarrollo,0.75
"Revisar y actualizar las politicas de privacidad de la empresa.",Legal y Cumplimiento,0.9
"Contratar a un nuevo gerente de ventas para la region de America Latina.",Recursos Humanos,0.85
"Elaborar el presupuesto anual de la empresa.",Finanzas y Contabilidad,0.95
"Resolver una queja de un cliente insatisfecho.",Atencion al Cliente,0.8
"Lanzar una nueva promocion en las redes sociales.",Ventas y Marketing,0.8
"Optimizar el proceso de produccion para reducir costos.",Operaciones o Produccion,0.85
"Implementar un nuevo sistema de gestion de proyectos.",Tecnologia de la Informacion,0.9
"Evaluar el desempeno de los proveedores actuales.",Compras y Abastecimiento,0.75
"Desarrollar un nuevo producto para el mercado de la tercera edad.",Investigacion y Desarrollo,0.8
"Asegurar el cumplimiento de las normas de seguridad laboral.",Legal y Cumplimiento,0.9
"Realizar encuestas de satisfaccion a los empleados.",Recursos Humanos,0.7
"Preparar los estados financieros para la auditoria externa.",Finanzas y Contabilidad,0.95
"Responder a las preguntas frecuentes de los clientes en el sitio web.",Atencion al Cliente,0.8
"Crear contenido para el blog de la empresa.",Ventas y Marketing,0.75
"Mejorar la eficiencia del proceso de embalaje.",Operaciones o Produccion,0.8
"Actualizar la infraestructura de la red de la empresa.",Tecnologia de la Informacion,0.9
"Buscar nuevos proveedores de servicios de logistica.",Compras y Abastecimiento,0.85
"Investigar nuevas tendencias en el mercado de alimentos organicos.",Investigacion y Desarrollo,0.8
"Asesorar a la empresa sobre el cumplimiento de las leyes ambientales.",Legal y Cumplimiento,0.9
"Gestionar las nominas y beneficios de los empleados.",Recursos Humanos,0.9
"Analizar la rentabilidad de las diferentes lineas de productos.",Finanzas y Contabilidad,0.85
"Resolver problemas tecnicos de los clientes por telefono.",Atencion al Cliente,0.8
"Organizar un evento de lanzamiento de un nuevo producto.",Ventas y Marketing,0.8
"Implementar un sistema de control de calidad en la produccion.",Operaciones o Produccion,0.9
"Migrar los datos de la empresa a la nube.",Tecnologia de la Informacion,0.95
"Negociar descuentos con los proveedores para reducir costos.",Compras y Abastecimiento,0.8
"Desarrollar un nuevo algoritmo para mejorar la precision de las predicciones de ventas.",Investigacion y Desarrollo,0.85
"Redactar contratos y acuerdos legales.",Legal y Cumplimiento,0.9
"Realizar evaluaciones de desempeno a los empleados.",Recursos Humanos,0.8
"Gestionar el flujo de caja de la empresa.",Finanzas y Contabilidad,0.9
"Responder a las resenas de los clientes en las redes sociales.",Atencion al Cliente,0.75
"Crear anuncios publicitarios para diferentes canales de marketing.",Ventas y Marketing,0.8
"Automatizar el proceso de inventario.",Operaciones o Produccion,0.85
"Implementar un sistema de seguridad informatica para proteger los datos de la empresa.",Tecnologia de la Informacion,0.9
"Buscar proveedores de materiales de embalaje ecologicos.",Compras y Abastecimiento,0.8
"Investigar nuevas formas de reducir el consumo de energia en la produccion.",Investigacion y Desarrollo,0.8
"Asegurar el cumplimiento de las leyes de proteccion de datos.",Legal y Cumplimiento,0.9
"Desarrollar programas de capacitacion para los empleados.",Recursos Humanos,0.8
"Realizar el cierre contable mensual.",Finanzas y Contabilidad,0.9
"Gestionar las quejas de los clientes en persona.",Atencion al Cliente,0.85
"Analizar el retorno de la inversion de las campanas de marketing.",Ventas y Marketing,0.8
"Realizar una encuesta de satisfaccion salarial entre los empleados.",Recursos Humanos,0.75
"Preparar el informe de flujo de caja para la junta directiva.",Finanzas y Contabilidad,0.90
"Disenar una campana de publicidad en Google Ads para aumentar las ventas.",Ventas y Marketing,0.85
"Reorganizar el layout de la fabrica para mejorar la eficiencia.",Operaciones o Produccion,0.82
"Implementar un sistema de autenticacion de dos factores para los empleados.",Tecnologia de la Informacion,0.92
"Resolver las quejas de los clientes sobre el servicio de postventa.",Atencion al Cliente,0.88
"Comprar insumos para la produccion del proximo trimestre.",Compras y Abastecimiento,0.78
"Desarrollar un nuevo software de gestion de proyectos.",Investigacion y Desarrollo,0.87
"Revisar los contratos de los proveedores para asegurar el cumplimiento de normas.",Legal y Cumplimiento,0.83
"Organizar la reunion anual de accionistas.",Administracion y Gestion General,0.80
"Capacitar al personal en el uso de nuevas herramientas de productividad.",Recursos Humanos,0.77
"Auditar los gastos de viaje de los ejecutivos.",Finanzas y Contabilidad,0.86
"Crear una estrategia de ventas cruzadas para aumentar los ingresos.",Ventas y Marketing,0.84
"Implementar un sistema de control de calidad en la linea de produccion.",Operaciones o Produccion,0.89
"Migrar las aplicaciones internas a la nube para mejorar la accesibilidad.",Tecnologia de la Informacion,0.93
"Atender las solicitudes de garantia de los productos vendidos.",Atencion al Cliente,0.81
"Comprar equipos de proteccion personal para los empleados de produccion.",Compras y Abastecimiento,0.74
"Investigar nuevas tecnologias para reducir el impacto ambiental.",Investigacion y Desarrollo,0.85
"Revisar las politicas de privacidad de datos de los clientes.",Legal y Cumplimiento,0.88
"Coordinar la logistica para la conferencia anual de la empresa.",Administracion y Gestion General,0.79
"Realizar entrevistas para cubrir el puesto de gerente de operaciones.",Recursos Humanos,0.82
"Analizar los costos de produccion para identificar areas de mejora.",Finanzas y Contabilidad,0.87
