Entrada,Departamento,Prioridad
"Negociar un acuerdo de compra de productos de oficina con un proveedor local de materiales de teletransportacion.",Compras y Abastecimiento,0.8
"Investigar nuevas tecnicas de telepatia cuantica para la optimizacion de procesos dimensionales complejos.",Investigacion y Desarrollo,0.85
"Actualizar las politicas de la empresa sobre el uso de dispositivos de telepatia cuantica en el trabajo.",Legal y Cumplimiento,0.8
"Publicar ofertas de empleo en plataformas de empleo especializadas en telepatia cuantica.",Recursos Humanos,0.8
"Realizar el seguimiento de los pagos realizados a proveedores de servicios de consultoria en gestion de proyectos de telepatia cuantica.",Finanzas y Contabilidad,0.9
"Gestionar las solicitudes de cambio de direccion de correo telepatico de los clientes.",Atencion al Cliente,0.8
"Crear un catalogo de productos para la tienda virtual en diferentes formatos (telepatico, holografico, etc.).",Ventas y Marketing,0.85
"Implementar un sistema de gestion de la seguridad de la informacion en entornos de simulacion de dimensiones paralelas.",Operaciones o Produccion,0.9
"Realizar pruebas de seguridad en los sistemas de gestion de bases de datos telepaticas.",Tecnologia de la Informacion,0.95
"Evaluar la viabilidad de la compra de nuevos equipos de transporte interdimensional.",Compras y Abastecimiento,0.8
"Desarrollar un modelo de simulacion para la optimizacion de la gestion de proyectos de telepatia cuantica.",Investigacion y Desarrollo,0.9
"Revisar y actualizar los acuerdos de confidencialidad con proveedores de servicios de consultoria en telepatia cuantica.",Legal y Cumplimiento,0.9
"Realizar encuestas de satisfaccion a los distribuidores en diferentes dimensiones y realidades alternativas.",Recursos Humanos,0.7
"Analizar la variacion del precio de los portales dimensionales en los costos de importacion de componentes de telepatia cuantica.",Finanzas y Contabilidad,0.8
"Responder a las preguntas de los clientes en el foro de la comunidad de desarrolladores de telepatia cuantica.",Atencion al Cliente,0.8
"Disenar una campana publicitaria en medios digitales para un evento de lanzamiento en diferentes dimensiones, realidades alternativas y lineas temporales.",Ventas y Marketing,0.85
"Mejorar la eficiencia del proceso de carga y descarga de naves interdimensionales en el puerto dimensional.",Operaciones o Produccion,0.8
"Implementar un sistema de gestion de vulnerabilidades para los sistemas operativos y aplicaciones en diferentes entornos de telepatia cuantica.",Tecnologia de la Informacion,0.9
"Buscar nuevos proveedores de servicios de almacenamiento de datos en centros de datos ubicados en diferentes dimensiones y realidades alternativas.",Compras y Abastecimiento,0.8
"Investigar nuevas tecnologias para la produccion de materiales biodegradables a partir de residuos de portales dimensionales.",Investigacion y Desarrollo,0.85
"Asegurar el cumplimiento de las leyes de propiedad intelectual en el ambito de la teletransportacion cuantica.",Legal y Cumplimiento,0.9
"Desarrollar un programa de formacion para los empleados sobre nuevas tendencias en el mercado de la teletransportacion cuantica.",Recursos Humanos,0.8
"desarrollo en teletransportacion cuantica.",Finanzas y Contabilidad,0.9
"Gestionar las quejas de los clientes por teletransportacion en diferentes idiomas, dimensiones, realidades alternativas y lineas temporales.",Atencion al Cliente,0.8
"Crear contenido para el blog corporativo en diferentes idiomas, formatos, dimensiones, realidades alternativas y lineas temporales.",Ventas y Marketing,0.75
"Coordinar la logistica para el envio de productos a clientes en lineas temporales alternativas.",Operaciones o Produccion,0.85
"Realizar un analisis de la rentabilidad de los programas de manipulacion del tiempo de clientes.",Finanzas y Contabilidad,0.9
"Responder a las consultas de los clientes sobre la integracion de productos con sistemas de manipulacion del tiempo.",Atencion al Cliente,0.8
"Desarrollar una campana de marketing en redes sociales para el lanzamiento de un nuevo servicio de consultoria en manipulacion del tiempo.",Ventas y Marketing,0.8
"Realizar el mantenimiento preventivo de los sistemas de transporte temporal en la produccion.",Operaciones o Produccion,0.9
"Configurar un sistema de gestion de la seguridad de la informacion en entornos de manipulacion del tiempo.",Tecnologia de la Informacion,0.95
"Negociar un acuerdo de compra de productos de oficina con un proveedor local de materiales de manipulacion del tiempo.",Compras y Abastecimiento,0.8
"Investigar nuevas tecnicas de manipulacion del tiempo para la optimizacion de procesos temporales complejos.",Investigacion y Desarrollo,0.85
"Actualizar las politicas de la empresa sobre el uso de dispositivos de manipulacion del tiempo en el trabajo.",Legal y Cumplimiento,0.8
"Publicar ofertas de empleo en plataformas de empleo especializadas en manipulacion del tiempo.",Recursos Humanos,0.8
"Realizar el seguimiento de los pagos realizados a proveedores de servicios de consultoria en gestion de proyectos de manipulacion del tiempo.",Finanzas y Contabilidad,0.9
"Gestionar las solicitudes de cambio de direccion de correo temporal de los clientes.",Atencion al Cliente,0.8
"Crear un catalogo de productos para la tienda virtual en diferentes formatos (temporal, atemporal, etc.).",Ventas y Marketing,0.85
"Implementar un sistema de gestion de la seguridad de la informacion en entornos de simulacion de lineas temporales alternativas.",Operaciones o Produccion,0.9
"Realizar pruebas de seguridad en los sistemas de gestion de bases de datos temporales.",Tecnologia de la Informacion,0.95
"Evaluar la viabilidad de la compra de nuevos equipos de transporte intertemporal.",Compras y Abastecimiento,0.8
"Desarrollar un modelo de simulacion para la optimizacion de la gestion de proyectos de manipulacion del tiempo.",Investigacion y Desarrollo,0.9
"Revisar y actualizar los acuerdos de confidencialidad con proveedores de servicios de consultoria en manipulacion del tiempo.",Legal y Cumplimiento,0.9
"Realizar encuestas de satisfaccion a los distribuidores en diferentes lineas temporales y realidades alternativas.",Recursos Humanos,0.7
"Analizar la variacion del precio de los relojes temporales en los costos de importacion de componentes de manipulacion del tiempo.",Finanzas y Contabilidad,0.8
"Responder a las preguntas de los clientes en el foro de la comunidad de desarrolladores de manipulacion del tiempo.",Atencion al Cliente,0.8
"Disenar una campana publicitaria en medios digitales para un evento de lanzamiento en diferentes lineas temporales, realidades alternativas y dimensiones.",Ventas y Marketing,0.85
"Mejorar la eficiencia del proceso de carga y descarga de naves intertemporales en el puerto temporal.",Operaciones o Produccion,0.8
"Implementar un sistema de gestion de vulnerabilidades para los sistemas operativos y aplicaciones en diferentes entornos de manipulacion del tiempo.",Tecnologia de la Informacion,0.9
"Buscar nuevos proveedores de servicios de almacenamiento de datos en centros de datos ubicados en diferentes lineas temporales y realidades alternativas.",Compras y Abastecimiento,0.8
"Investigar nuevas tecnologias para la produccion de materiales biodegradables a partir de residuos de relojes temporales.",Investigacion y Desarrollo,0.85
"Asegurar el cumplimiento de las leyes de propiedad intelectual en el ambito de la manipulacion del tiempo cuantica.",Legal y Cumplimiento,0.9
"Desarrollar un programa de formacion para los empleados sobre nuevas tendencias en el mercado de la manipulacion del tiempo cuantica.",Recursos Humanos,0.8
"Realizar el analisis de la viabilidad financiera de un nuevo proyecto de investigacion y desarrollo en manipulacion del tiempo cuantica.",Finanzas y Contabilidad,0.9
"Gestionar las quejas de los clientes por manipulacion del tiempo en diferentes idiomas, lineas temporales y realidades alternativas.",Atencion al Cliente,0.8
"Crear contenido para el blog corporativo en diferentes idiomas, formatos, lineas temporales y realidades alternativas.",Ventas y Marketing,0.75
"Coordinar la logistica para el envio de productos a clientes en realidades alternativas.",Operaciones o Produccion,0.85
"Realizar un analisis de la rentabilidad de los programas de alteracion de la realidad de clientes.",Finanzas y Contabilidad,0.9
"Responder a las consultas de los clientes sobre la integracion de productos con sistemas de alteracion de la realidad.",Atencion al Cliente,0.8
"Desarrollar una campana de marketing en redes sociales para el lanzamiento de un nuevo servicio de consultoria en alteracion de la realidad.",Ventas y Marketing,0.8
"Realizar el mantenimiento preventivo de los sistemas de transporte de realidad en la produccion.",Operaciones o Produccion,0.9
"Configurar un sistema de gestion de la seguridad de la informacion en entornos de alteracion de la realidad.",Tecnologia de la Informacion,0.95
"Negociar un acuerdo de compra de productos de oficina con un proveedor local de materiales de alteracion de la realidad.",Compras y Abastecimiento,0.8
"Investigar nuevas tecnicas de alteracion de la realidad para la optimizacion de procesos de realidad complejos.",Investigacion y Desarrollo,0.85
"Actualizar las politicas de la empresa sobre el uso de dispositivos de alteracion de la realidad en el trabajo.",Legal y Cumplimiento,0.8
"Publicar ofertas de empleo en plataformas de empleo especializadas en alteracion de la realidad.",Recursos Humanos,0.8
"Realizar el seguimiento de los pagos realizados a proveedores de servicios de consultoria en gestion de proyectos de alteracion de la realidad.",Finanzas y Contabilidad,0.9
"Gestionar las solicitudes de cambio de direccion de correo de realidad de los clientes.",Atencion al Cliente,0.8
"Crear un catalogo de productos para la tienda virtual en diferentes formatos (realidad virtual, realidad aumentada, etc.).",Ventas y Marketing,0.85
"Implementar un sistema de gestion de la seguridad de la informacion en entornos de simulacion de realidades alternativas.",Operaciones o Produccion,0.9
"Realizar pruebas de seguridad en los sistemas de gestion de bases de datos de realidad.",Tecnologia de la Informacion,0.95
"Evaluar la viabilidad de la compra de nuevos equipos de transporte interrealidad.",Compras y Abastecimiento,0.8
"Desarrollar un modelo de simulacion para la optimizacion de la gestion de proyectos de alteracion de la realidad.",Investigacion y Desarrollo,0.9
"Revisar y actualizar los acuerdos de confidencialidad con proveedores de servicios de consultoria en alteracion de la realidad.",Legal y Cumplimiento,0.9
"Realizar encuestas de satisfaccion a los distribuidores en diferentes realidades alternativas y lineas temporales.",Recursos Humanos,0.7
"Realizar una encuesta de satisfaccion salarial entre los empleados.",Recursos Humanos,0.75
"Preparar el informe de flujo de caja para la junta directiva.",Finanzas y Contabilidad,0.90
"Disenar una campana de publicidad en Google Ads para aumentar las ventas.",Ventas y Marketing,0.85
"Reorganizar el layout de la fabrica para mejorar la eficiencia.",Operaciones o Produccion,0.82
"Implementar un sistema de autenticacion de dos factores para los empleados.",Tecnologia de la Informacion,0.92
"Resolver las quejas de los clientes sobre el servicio de postventa.",Atencion al Cliente,0.88
"Comprar insumos para la produccion del proximo trimestre.",Compras y Abastecimiento,0.78
"Desarrollar un nuevo software de gestion de proyectos.",Investigacion y Desarrollo,0.87
"Revisar los contratos de los proveedores para asegurar el cumplimiento de normas.",Legal y Cumplimiento,0.83
"Organizar la reunion anual de accionistas.",Administracion y Gestion General,0.80
"Capacitar al personal en el uso de nuevas herramientas de productividad.",Recursos Humanos,0.77
"Auditar los gastos de viaje de los ejecutivos.",Finanzas y Contabilidad,0.86
"Crear una estrategia de ventas cruzadas para aumentar los ingresos.",Ventas y Marketing,0.84
"Implementar un sistema de control de calidad en la linea de produccion.",Operaciones o Produccion,0.89
"Migrar las aplicaciones internas a la nube para mejorar la accesibilidad.",Tecnologia de la Informacion,0.93
"Atender las solicitudes de garantia de los productos vendidos.",Atencion al Cliente,0.81
"Comprar equipos de proteccion personal para los empleados de produccion.",Compras y Abastecimiento,0.74
"Investigar nuevas tecnologias para reducir el impacto ambiental.",Investigacion y Desarrollo,0.85
"Revisar las politicas de privacidad de datos de los clientes.",Legal y Cumplimiento,0.88
"Coordinar la logistica para la conferencia anual de la empresa.",Administracion y Gestion General,0.79
"Realizar entrevistas para cubrir el puesto de gerente de operaciones.",Recursos Humanos,0.82
"Analizar los costos de produccion para identificar areas de mejora.",Finanzas y Contabilidad,0.87
"Lanzar una campana de descuentos para clientes recurrentes.",Ventas y Marketing,0.83
"Optimizar el proceso de embalaje para reducir costos.",Operaciones o Produccion,0.84
"Implementar un sistema de monitoreo en tiempo real para los servidores.",Tecnologia de la Informacion,0.94
"Resolver las quejas sobre el tiempo de respuesta del soporte tecnico.",Atencion al Cliente,0.80
"Comprar material de oficina para el nuevo departamento de ventas.",Compras y Abastecimiento,0.70
"Desarrollar un nuevo producto basado en blockchain.",Investigacion y Desarrollo,0.89
"Revisar los acuerdos de confidencialidad con los socios estrategicos.",Legal y Cumplimiento,0.84
"Organizar el evento de lanzamiento del nuevo producto.",Administracion y Gestion General,0.78
"Evaluar el desempeno de los empleados para el ciclo de promociones.",Recursos Humanos,0.81
"Preparar el informe de impuestos corporativos para el ano fiscal.",Finanzas y Contabilidad,0.91
"Crear una estrategia de marketing viral para el nuevo servicio.",Ventas y Marketing,0.86
"Reducir los tiempos de inactividad en la linea de produccion.",Operaciones o Produccion,0.87
"Implementar un sistema de gestion de incidentes para el departamento de IT.",Tecnologia de la Informacion,0.92
"Capacitar al equipo de atencion al cliente en tecnicas de ventas.",Atencion al Cliente,0.76
"Comprar equipos de prueba para el laboratorio de I+D.",Compras y Abastecimiento,0.73
"Investigar nuevas tendencias de mercado para lanzar un producto innovador.",Investigacion y Desarrollo,0.88
"Revisar los contratos laborales para asegurar el cumplimiento de leyes locales.",Legal y Cumplimiento,0.85
"Coordinar la actualizacion de los manuales de procedimientos de la empresa.",Administracion y Gestion General,0.77
"Contratar a un especialista en diversidad e inclusion.",Recursos Humanos,0.79
"Analizar los costos de logistica para optimizar las rutas de distribucion.",Finanzas y Contabilidad,0.86
"Lanzar una campana de marketing en influencers para aumentar la visibilidad.",Ventas y Marketing,0.84
"Mejorar la eficiencia energetica en las instalaciones de produccion.",Operaciones o Produccion,0.83
"Implementar un sistema de backup en la nube para los datos criticos.",Tecnologia de la Informacion,0.93
"Resolver las quejas de los clientes sobre la calidad del producto.",Atencion al Cliente,0.82
"Comprar herramientas para el equipo de mantenimiento de las instalaciones.",Compras y Abastecimiento,0.72
"Desarrollar un prototipo de aplicacion movil para la gestion de inventarios.",Investigacion y Desarrollo,0.90
"Revisar los acuerdos de confidencialidad con los clientes corporativos.",Legal y Cumplimiento,0.87
"Organizar la capacitacion en habilidades blandas para los empleados.",Administracion y Gestion General,0.75
"Realizar una evaluacion de clima laboral para identificar areas de mejora.",Recursos Humanos,0.78
"Preparar el informe de ingresos y gastos para la junta directiva.",Finanzas y Contabilidad,0.89
"Disenar una campana de marketing en TikTok para llegar a un publico mas joven.",Ventas y Marketing,0.83
"Optimizar el proceso de almacenamiento para reducir costos logisticos.",Operaciones o Produccion,0.85
"Implementar un sistema de gestion de contrasenas para mejorar la seguridad.",Tecnologia de la Informacion,0.91
"Atender las quejas de los clientes sobre el tiempo de entrega de los productos.",Atencion al Cliente,0.87
"Comprar materias primas para la produccion del proximo mes.",Compras y Abastecimiento,0.76
"Desarrollar un nuevo algoritmo de recomendacion para la plataforma de ventas.",Investigacion y Desarrollo,0.88
"Revisar los contratos de los proveedores para asegurar terminos favorables.",Legal y Cumplimiento,0.82
"Organizar la reunion trimestral de revision de objetivos.",Administracion y Gestion General,0.79
"Capacitar al personal en el uso de herramientas de analisis de datos.",Recursos Humanos,0.80
"Auditar los gastos de marketing del ultimo trimestre.",Finanzas y Contabilidad,0.86
"Crear una estrategia de ventas para expandirse a nuevos mercados.",Ventas y Marketing,0.84
"Implementar un sistema de mantenimiento predictivo para la maquinaria.",Operaciones o Produccion,0.88
"Migrar las aplicaciones internas a un servidor mas seguro.",Tecnologia de la Informacion,0.92
"Resolver las solicitudes de reembolso de los clientes de manera agil.",Atencion al Cliente,0.81
"Comprar equipos de seguridad para el personal de almacen.",Compras y Abastecimiento,0.73
"Investigar nuevas tecnologias para mejorar la calidad del producto.",Investigacion y Desarrollo,0.87
"Revisar las politicas de privacidad de datos de los empleados.",Legal y Cumplimiento,0.85
"Coordinar la logistica para el evento de lanzamiento del nuevo producto.",Administracion y Gestion General,0.80
"Realizar entrevistas para cubrir el puesto de gerente de marketing.",Recursos Humanos,0.83
"Analizar los margenes de ganancia de los productos mas vendidos.",Finanzas y Contabilidad,0.88
"Lanzar una campana de email marketing para promocionar las ofertas de fin de ano.",Ventas y Marketing,0.82
"Optimizar el proceso de embalaje para reducir costos y desperdicios.",Operaciones o Produccion,0.84
"Implementar un sistema de monitoreo en tiempo real para la red corporativa.",Tecnologia de la Informacion,0.93
"Resolver las quejas de los clientes sobre la falta de stock en los productos.",Atencion al Cliente,0.79
"Comprar material de oficina para el nuevo equipo de ventas.",Compras y Abastecimiento,0.71
"Desarrollar un nuevo prototipo de producto basado en inteligencia artificial.",Investigacion y Desarrollo,0.90
"Revisar los acuerdos de confidencialidad con los socios comerciales.",Legal y Cumplimiento,0.86
"Organizar la capacitacion en habilidades de liderazgo para los gerentes.",Administracion y Gestion General,0.77
"Evaluar el desempeno de los empleados para el ciclo de bonificaciones.",Recursos Humanos,0.81
"Preparar el informe de impuestos corporativos para el proximo ano fiscal.",Finanzas y Contabilidad,0.92
"Crear una estrategia de marketing digital para aumentar la visibilidad de la marca.",Ventas y Marketing,0.85
"Reducir los tiempos de inactividad en la linea de produccion mediante mejoras tecnicas.",Operaciones o Produccion,0.89
"Implementar un sistema de respaldo automatico para los servidores criticos.",Tecnologia de la Informacion,0.94
"Capacitar al equipo de atencion al cliente en tecnicas de ventas cruzadas.",Atencion al Cliente,0.78
"Comprar equipos de prueba para el laboratorio de control de calidad.",Compras y Abastecimiento,0.74
"Investigar nuevas tendencias de mercado para lanzar un producto innovador.",Investigacion y Desarrollo,0.89
"Revisar los contratos laborales para asegurar el cumplimiento de las normativas locales.",Legal y Cumplimiento,0.84
"Coordinar la actualizacion de los manuales de procedimientos de la empresa.",Administracion y Gestion General,0.76
"Contratar a un especialista en diversidad e inclusion para mejorar el clima laboral.",Recursos Humanos,0.82
"Analizar los costos de transporte para optimizar las rutas de distribucion.",Finanzas y Contabilidad,0.87
"Lanzar una campana de marketing en influencers para aumentar la visibilidad de la marca.",Ventas y Marketing,0.86
"Mejorar la eficiencia energetica en las instalaciones de produccion.",Operaciones o Produccion,0.83
"Implementar un sistema de backup en la nube para los datos criticos de la empresa.",Tecnologia de la Informacion,0.95
"Resolver las quejas de los clientes sobre la calidad del servicio postventa.",Atencion al Cliente,0.80
"Comprar herramientas para el equipo de mantenimiento de las instalaciones.",Compras y Abastecimiento,0.72
"Desarrollar un prototipo de aplicacion movil para la gestion de inventarios.",Investigacion y Desarrollo,0.91
"Revisar los acuerdos de confidencialidad con los clientes corporativos.",Legal y Cumplimiento,0.88
"Organizar la capacitacion en habilidades blandas para los empleados.",Administracion y Gestion General,0.75
"Analizar la variacion del precio de los generadores de realidad en los costos de importacion de componentes de alteracion de la realidad.",Finanzas y Contabilidad,0.8
"Responder a las preguntas de los clientes en el foro de la comunidad de desarrolladores de alteracion de la realidad.",Atencion al Cliente,0.8
"Disenar una campana publicitaria en medios digitales para un evento de lanzamiento en diferentes realidades alternativas, lineas temporales y dimensiones.",Ventas y Marketing,0.85
"Mejorar la eficiencia del proceso de carga y descarga de naves interrealidad en el puerto de realidad.",Operaciones o Produccion,0.8
"Implementar un sistema de gestion de vulnerabilidades para los sistemas operativos y aplicaciones en diferentes entornos de alteracion de la realidad.",Tecnologia de la Informacion,0.9
"Buscar nuevos proveedores de servicios de almacenamiento de datos en centros de datos ubicados en diferentes realidades alternativas y lineas temporales.",Compras y Abastecimiento,0.8
"Investigar nuevas tecnologias para la produccion de materiales biodegradables a partir de residuos de generadores de realidad.",Investigacion y Desarrollo,0.85
"Asegurar el cumplimiento de las leyes de propiedad intelectual en el ambito de la alteracion de la realidad cuantica.",Legal y Cumplimiento,0.9
"Desarrollar un programa de formacion para los empleados sobre nuevas tendencias en el mercado de la alteracion de la realidad cuantica.",Recursos Humanos,0.8
"Realizar el analisis de la viabilidad financiera de un nuevo proyecto de investigacion y desarrollo en alteracion de la realidad cuantica.",Finanzas y Contabilidad,0.9
"Gestionar las quejas de los clientes por alteracion de la realidad en diferentes idiomas, realidades alternativas y lineas temporales.",Atencion al Cliente,0.8
"Crear contenido para el blog corporativo en diferentes idiomas, formatos, realidades alternativas y lineas temporales.",Ventas y Marketing,0.75
"Coordinar la logistica para el envio de productos a clientes en universos paralelos.",Operaciones o Produccion,0.85
"Realizar un analisis de la rentabilidad de los programas de creacion de universos de clientes.",Finanzas y Contabilidad,0.9
"Responder a las consultas de los clientes sobre la integracion de productos con sistemas de creacion de universos.",Atencion al Cliente,0.8
"Desarrollar una campana de marketing en redes sociales para el lanzamiento de un nuevo servicio de consultoria en creacion de universos.",Ventas y Marketing,0.8
"Realizar el mantenimiento preventivo de los sistemas de transporte universal en la produccion.",Operaciones o Produccion,0.9
"Configurar un sistema de gestion de la seguridad de la informacion en entornos de creacion de universos.",Tecnologia de la Informacion,0.95
"Negociar un acuerdo de compra de productos de oficina con un proveedor local de materiales de creacion de universos.",Compras y Abastecimiento,0.8
"Investigar nuevas tecnicas de creacion de universos para la optimizacion de procesos universales complejos.",Investigacion y Desarrollo,0.85
"Actualizar las politicas de la empresa sobre el uso de dispositivos de creacion de universos en el trabajo.",Legal y Cumplimiento,0.8
"Publicar ofertas de empleo en plataformas de empleo especializadas en creacion de universos.",Recursos Humanos,0.8
"Realizar el seguimiento de los pagos realizados a proveedores de servicios de consultoria en gestion de proyectos de creacion de universos.",Finanzas y Contabilidad,0.9
"Gestionar las solicitudes de cambio de direccion de correo universal de los clientes.",Atencion al Cliente,0.8
"Crear un catalogo de productos para la tienda virtual en diferentes formatos (universal, multiversal, etc.).",Ventas y Marketing,0.85
"Implementar un sistema de gestion de la seguridad de la informacion en entornos de simulacion de universos paralelos.",Operaciones o Produccion,0.9
"Realizar pruebas de seguridad en los sistemas de gestion de bases de datos universales.",Tecnologia de la Informacion,0.95
"Evaluar la viabilidad de la compra de nuevos equipos de transporte interuniversal.",Compras y Abastecimiento,0.8
"Desarrollar un modelo de simulacion para la optimizacion de la gestion de proyectos de creacion de universos.",Investigacion y Desarrollo,0.9
"Revisar y actualizar los acuerdos de confidencialidad con proveedores de servicios de consultoria en creacion de universos.",Legal y Cumplimiento,0.9
"Realizar encuestas de satisfaccion a los distribuidores en diferentes universos paralelos y realidades alternativas.",Recursos Humanos,0.7
"Analizar la variacion del precio de los generadores de universos en los costos de importacion de componentes de creacion de universos.",Finanzas y Contabilidad,0.8
"Responder a las preguntas de los clientes en el foro de la comunidad de desarrolladores de creacion de universos.",Atencion al Cliente,0.8
"Disenar una campana publicitaria en medios digitales para un evento de lanzamiento en diferentes universos paralelos, realidades alternativas y lineas temporales.",Ventas y Marketing,0.85
